15933050	2	10	ENSP00000222304	DOID:2352	The rapid and sustained action of a single dose of MYGENETOKEN makes it an appealing agent for the prevention of iron accumulation in hereditary MYDISEASETOKEN.
21150441	2	4	ENSP00000222304	DOID:2352	These advances have modified our understanding of the pathophysiology of MYDISEASETOKEN, now considered a disorder either due to MYGENETOKEN deficiency or (rarely) due to MYGENETOKEN resistance.
23651750	2	1	ENSP00000337014	DOID:2352	Juvenile MYDISEASETOKEN caused by a homozygous Gly320Val mutation in the haemojuvelin (MYGENETOKEN) gene was diagnosed in a 12-year-old Danish girl and her 10-year-old sister.
28514781	2	3	ENSP00000222304	DOID:2352	Genetic alterations influence the serum MYGENETOKEN concentration, which can lead to an iron overload in tissues, as observed in MYDISEASETOKEN, in which serum MYGENETOKEN or defective MYGENETOKEN synthesis is observed.
26059880	1	1	ENSP00000261024	DOID:2352	Novel gain of function mutation in the MYGENETOKEN gene associated with hereditary MYDISEASETOKEN type 4.
17654685	1	1	ENSP00000369351	DOID:2352	MYDISEASETOKEN-associated gene mutations in patients with myelodysplastic syndromes with MYGENETOKEN with ringed sideroblasts.
14226168	1	1	ENSP00000369351	DOID:2352	LATE CARDIAC COMPLICATIONS OF CHRONIC, SEVERE, MYGENETOKEN WITH MYDISEASETOKEN.
18384687	2	2	ENSP00000337014	DOID:2352	Inactivating mutations in the MYGENETOKEN gene cause juvenile MYDISEASETOKEN (JH), a rapidly progressing MYDISEASETOKEN with severe systemic manifestations.
16099526	2	8	ENSP00000337014	DOID:2352	The age at initial presentation of MYGENETOKEN-MYDISEASETOKEN occurs over a wider range than previously described.
20593054	1	1	ENSP00000337014	DOID:2352	Homozygous G320V mutation in the MYGENETOKEN gene causing juvenile hereditary MYDISEASETOKEN type A.
4053696	2	6	ENSP00000366005	DOID:2352	The results confirm the association between the MYGENETOKEN and B loci and the MYDISEASETOKEN gene.
11984516	2	2	ENSP00000223051	DOID:2352	Type 3 MYDISEASETOKEN, recently described in 4 families, is linked to mutations of the gene encoding MYGENETOKEN on chromosome 7q22.
11472372	1	1	ENSP00000264613	DOID:2352	Reduced serum MYGENETOKEN levels in hereditary MYDISEASETOKEN.
24816001	2	8	ENSP00000366482	DOID:2352	Comorbid MYDISEASETOKEN may worsen MYGENETOKEN symptoms through additive effects on iron metabolism.
27740525	0	25	ENSP00000355607	DOID:2352	MYGENETOKEN variant (D519G) is not associated with an elevated serum ferritin or iron removed by phlebotomy in patients referred for C282Y-linked MYDISEASETOKEN.
27867027	2	4	ENSP00000222304	DOID:2352	Altered levels of extracellular MYGENETOKEN lead to pathological conditions such as MYDISEASETOKEN and iron loading or, on the other side, iron restrictive anemias.
25737209	2	6	ENSP00000222304	DOID:2352	The majority of the hereditary MYDISEASETOKEN (HH) patients are now shown to have mutations in the genes coding either upstream or downstream proteins of MYGENETOKEN, resulting in iron overload.
12637325	2	3	ENSP00000222304	DOID:2352	Using quantitative reverse transcriptase-polymerase chain reaction (RT-PCR), we determined expression of MYGENETOKEN and the most relevant iron-related genes in liver biopsies from patients with MYDISEASETOKEN and iron-stain-negative control subjects.
26975792	2	1	ENSP00000222304	DOID:2352	MYDISEASETOKEN is now known to be an MYDISEASETOKEN with genetic heterogeneity but with a final common metabolic pathway resulting in inappropriately low production of the hormone MYGENETOKEN.
19234060	2	1	ENSP00000337014	DOID:2352	Mutations in MYGENETOKEN (MYGENETOKEN) cause severe juvenile MYDISEASETOKEN, characterized by iron loading of the heart, liver, and pancreas.
14647275	1	1	ENSP00000337014	DOID:2352	Mutations in MYGENETOKEN cause iron overload in chromosome 1q-linked juvenile MYDISEASETOKEN.
26474245	2	11	ENSP00000222304	DOID:2352	Thirteen patients with a LIC&gt;70 mymol/g were enrolled in further genetic analyses: two unrelated patients bore the MYGENETOKEN:c.-153C&gt;T mutation at the heterozygous state, which is associated with increased risk of IO and severe MYDISEASETOKEN.
15811010	1	1	ENSP00000337014	DOID:2352	MYGENETOKEN gene mutations in European patients with juvenile MYDISEASETOKEN.
16103117	2	16	ENSP00000337014	DOID:2352	Mutations in MYGENETOKEN are implicated in the majority of diagnosed juvenile MYDISEASETOKEN patients.
12940442	2	8	ENSP00000398698	DOID:2352	Additionally, the G/A polymorphisms at position -238 and -308 of the MYGENETOKEN, gene were determined by PCR and RFLP analysis in 178 MYDISEASETOKEN patients and 41 controls.
14630809	1	1	ENSP00000222304	DOID:2352	Screening MYGENETOKEN for mutations in juvenile MYDISEASETOKEN: identification of a new mutation (C70R).
21264406	2	8	ENSP00000368752	DOID:2352	This raises the possibility that MYGENETOKEN(C) levels, or its activity, might regulate the progression of diseases in which altered metal homeostasis is thought to play a pathogenic role such as Alzheimer's, Parkinson's and Wilson's diseases and disorders such as MYDISEASETOKEN.
27740525	1	1	ENSP00000355607	DOID:2352	Previous studies in high and low expressors has demonstrated that a variant in the MYGENETOKEN gene (D519G, Rs11558492, chromosome 1, exon 11) has been associated with severe iron overload in C282Y homozygotes for MYDISEASETOKEN.
15737887	2	5	ENSP00000222304	DOID:2352	This finding indicates a fundamental role of MYGENETOKEN in inhibiting both iron absorption from duodenal cells and iron release from macrophages, and has opened up a new view of MYDISEASETOKEN as a disorder of MYGENETOKEN.
19342951	2	4	ENSP00000222304	DOID:2352	MYGENETOKEN, the iron hormone that is defective in MYDISEASETOKEN, is controlled not only by iron signals but also by a number of circulatory and membrane-associated regulators.
17724144	2	2	ENSP00000222304	DOID:2352	We explored the regulation of MYGENETOKEN by iron in 88 MYDISEASETOKEN patients (61 C282Y/C282Y, 27 C282Y/H63D) and 23 healthy controls by analyzing urinary MYGENETOKEN before and 24 hours after a 65-mg oral iron dose.
17124036	2	7	ENSP00000222304	DOID:2352	Recent studies indicate that MYGENETOKEN deficiency underlies most known forms of hereditary MYDISEASETOKEN.
16257244	2	2	ENSP00000261024	DOID:2352	Hereditary MYDISEASETOKEN may be caused by other genetic mutations including those in the MYGENETOKEN gene.
19383972	1	1	ENSP00000222304	DOID:2352	The molecular basis of MYGENETOKEN-resistant hereditary MYDISEASETOKEN.
18462824	2	6	ENSP00000222304	DOID:2352	Differently from what observed in MYDISEASETOKEN, MYGENETOKEN mRNA did not correlate with urinary MYGENETOKEN.
15138164	2	2	ENSP00000337014	DOID:2352	We report the occurrence of compound heterozygous mutations in MYGENETOKEN (MYGENETOKEN), including a termination codon, in a patient with juvenile MYDISEASETOKEN but no family history of iron disorders.
1633650	2	1	ENSP00000366005	DOID:2352	MYGENETOKEN and -B alleles in 74 Danish patients and 21 homozygous relatives with idiopathic MYDISEASETOKEN (IH) were compared with those in a sample of 1719 chromosomes from healthy Danish control subjects.
10663462	2	2	ENSP00000421655	DOID:2352	We therefore investigated 14 patients with hereditary MYDISEASETOKEN with MRI, CT and transcranial ultrasound (MYGENETOKEN) and examined them neurologically.
12401307	2	5	ENSP00000223051	DOID:2352	MYDISEASETOKEN type 3 is linked to a locus on 7q22 and is due to mutations in the MYGENETOKEN.
17339196	1	1	ENSP00000337014	DOID:2352	Juvenile MYDISEASETOKEN caused by a novel combination of MYGENETOKEN G320V/R176C mutations in a 5-year old girl.
24584909	1	1	ENSP00000337014	DOID:2352	Two middle-age-onset MYDISEASETOKEN patients with heterozygous mutations in the MYGENETOKEN gene in a Chinese family.
22297252	1	1	ENSP00000222304	DOID:2352	Identification of a novel mutation in the MYGENETOKEN gene that causes non-detectable MYGENETOKEN molecules in a Japanese male patient with juvenile MYDISEASETOKEN.
16793930	2	4	ENSP00000398698	DOID:2352	Of 86 patients with hereditary MYDISEASETOKEN, 16 (19%) were heterozygous carriers and 1 (1%) was a homozygous carrier of the MYGENETOKEN promoter -308A allele.
14982867	2	8	ENSP00000337014	DOID:2352	These studies confirm that mutations in MYGENETOKEN cause juvenile MYDISEASETOKEN.
24295741	2	3	ENSP00000222304	DOID:2352	In humans, a deficiency or resistance to the iron regulatory hormone, MYGENETOKEN has been implicated in the development of hereditary MYDISEASETOKEN.
28276324	1	1	ENSP00000223051	DOID:2352	MYGENETOKEN-related MYDISEASETOKEN in the Netherlands: a cause of arthralgia in young adulthood.
15986403	2	2	ENSP00000261024	DOID:2352	Mutations in the gene encoding MYGENETOKEN, a cellular iron exporter, are responsible for this MYDISEASETOKEN, inherited as an autosomal dominant trait.
15315789	1	1	ENSP00000337014	DOID:2352	Juvenile MYDISEASETOKEN MYGENETOKEN-related revealed by cardiogenic shock.
21864651	1	1	ENSP00000223051	DOID:2352	Hereditary MYDISEASETOKEN and MYGENETOKEN.
7918084	2	7	ENSP00000366005	DOID:2352	These results refine the HLA-A3 association with MYDISEASETOKEN, suggest that the MYDISEASETOKEN gene is located on the telomeric side of MYGENETOKEN and define a possible haplotype in which the first mutation may have occurred.
22297252	2	2	ENSP00000222304	DOID:2352	In this study, we identified a novel mutation in the MYGENETOKEN gene of a 58-year-old Japanese male patient with MYDISEASETOKEN.
17562347	1	1	ENSP00000223051	DOID:2352	A novel mutation of MYGENETOKEN in a Taiwanese woman with type 3 MYDISEASETOKEN.
17593421	2	4	ENSP00000337014	DOID:2352	MYGENETOKEN (MYGENETOKEN; also called repulsive guidance molecule c, MYGENETOKEN) is the third member of this family, and mutations in this gene result in a form of juvenile MYDISEASETOKEN (type 2A).
24658816	2	1	ENSP00000223051	DOID:2352	MYGENETOKEN (MYGENETOKEN) is a transmembrane glycoprotein expressed in the liver and in the erythroid compartment, mutated in a form of hereditary MYDISEASETOKEN.
21209031	2	1	ENSP00000222304	DOID:2352	MYGENETOKEN inhibits the intestinal absorption of iron and its deficiency causes juvenile MYDISEASETOKEN.
20951701	2	8	ENSP00000250971	DOID:2352	Dolphins with MYDISEASETOKEN had higher post-prandial plasma MYGENETOKEN levels compared to controls.
9556659	2	1	ENSP00000366005	DOID:2352	An ongoing family study of idiopathic MYDISEASETOKEN in Brittany, France, allowed us to investigate the segregation of this trait and its linkage and association to the MYGENETOKEN locus in 147 pedigrees, comprising 1,408 individuals with over 900 characterized for relevant biological parameters and typed for HLA.
15599216	2	3	ENSP00000222304	DOID:2352	Inappropriately low MYGENETOKEN is important to the pathophysiology of hereditary MYDISEASETOKEN.
22535765	2	6	ENSP00000222304	DOID:2352	E2 reduced MYGENETOKEN mRNA in wild-type mice as well as in MYDISEASETOKEN Fe gene knockout mice.
17633910	2	3	ENSP00000333994	DOID:2352	We describe a case of cardiac MYDISEASETOKEN complicated with fatal massive multiorgan embolism due to a large left ventricular thrombus in a patient with MYGENETOKEN.
18925311	2	13	ENSP00000222304	DOID:2352	MYGENETOKEN insufficiency as a primary cause of genetic MYDISEASETOKEN seems unlikely based on the clinical profile of the present patient and the MYGENETOKEN measurements.
22990014	1	1	ENSP00000222304	DOID:2352	Minihepcidins prevent iron overload in a MYGENETOKEN-deficient mouse model of severe MYDISEASETOKEN.
26805813	2	3	ENSP00000222304	DOID:2352	The advance in understanding the main players and mechanisms involved in iron regulation significantly improved since the discovery of genes responsible for MYDISEASETOKEN, the IRE/IRPs machinery, and the MYGENETOKEN-ferroportin axis.
15749661	2	14	ENSP00000223051	DOID:2352	Thus, MYGENETOKEN plays a role in the pathogenesis of MYDISEASETOKEN in Japan.
12663437	2	4	ENSP00000222304	DOID:2352	The key role of MYGENETOKEN is confirmed by the presence of nonsense mutations in the MYGENETOKEN gene, homozygous in the affected members, in 2 families with severe juvenile MYDISEASETOKEN.
21411349	1	11	ENSP00000337014	DOID:2352	Molecular and clinical diagnosis of juvenile MYDISEASETOKEN (homozygous form for the MYGENETOKEN p.G320V) was described for the first time in Brazil.
12469120	2	2	ENSP00000222304	DOID:2352	Here we report the identification of two mutations (93delG and 166C--&gt;T) in MYGENETOKEN on 19q13 in two families with a new type of juvenile MYDISEASETOKEN.
15084147	2	7	ENSP00000223051	DOID:2352	The implications of this observation for the understanding of the phenotypic features of MYDISEASETOKEN due to mutation of the MYGENETOKEN gene are discussed.
12382200	2	11	ENSP00000261024	DOID:2352	Plasma iron, together with dominant inheritance, discriminates iron overload due to ferroportin mutations (MYGENETOKEN) from MYDISEASETOKEN type 1.
15749651	1	1	ENSP00000223051	DOID:2352	Two novel mutations, L490R and V561X, in MYGENETOKEN in Japanese patients with MYDISEASETOKEN.
9659170	2	9	ENSP00000219070	DOID:2352	Serum MYGENETOKEN concentrations correlated with increasing degree of fibrosis in patients with MYDISEASETOKEN (r = 0.38, p = 0.01).
11313241	2	2	ENSP00000223051	DOID:2352	Recently, a new type of MYDISEASETOKEN (MYGENETOKEN) has been characterized in 2 unrelated Italian families with a disorder linked to 7q.
15967692	1	1	ENSP00000337014	DOID:2352	Juvenile MYDISEASETOKEN due to G320V/Q116X compound heterozygosity of MYGENETOKEN in an Irish patient.
18925311	2	2	ENSP00000222304	DOID:2352	It has been speculated that MYGENETOKEN insufficiency or dysregulation may be the primary defect in genetic MYDISEASETOKEN.
15461631	2	1	ENSP00000337014	DOID:2352	Mutations in the chromosome 1q-linked gene MYGENETOKEN (MYGENETOKEN) have recently been found to be a cause of juvenile MYDISEASETOKEN.
16538487	2	2	ENSP00000250971	DOID:2352	We therefore measured glucose tolerance, MYGENETOKEN secretory capacity and insulin sensitivity in adults with MYDISEASETOKEN.
1349563	1	1	ENSP00000366005	DOID:2352	Anonymous markers located on chromosome 6 in the MYGENETOKEN class I region: allelic distribution in genetic MYDISEASETOKEN.
18160816	1	1	ENSP00000261024	DOID:2352	MYGENETOKEN c.1402G--&gt;a results in aberrant splicing, ferroportin truncation after glycine 330, and an autosomal dominant MYDISEASETOKEN phenotype.
15024747	2	3	ENSP00000222304	DOID:2352	We have identified the c.208T&gt;C (p.C70R) mutation in the MYGENETOKEN gene in a patient affected by a severe form of hereditary MYDISEASETOKEN.
12865285	1	1	ENSP00000261024	DOID:2352	A novel mutation in MYGENETOKEN is associated with MYDISEASETOKEN in a Solomon Islands patient.
17949489	2	1	ENSP00000222304	DOID:2352	Hereditary MYDISEASETOKEN (HH) encompasses genetic disorders of iron overload characterized by deficient expression or function of the iron-regulatory hormone MYGENETOKEN.
28694024	2	8	ENSP00000222304	DOID:2352	Non-transfusional secondary MYDISEASETOKEN is due to MYGENETOKEN repression by cytokines, in particular the erythroferone factor that is produced directly by the erythroid precursors.
19937651	2	1	ENSP00000261024	DOID:2352	Mutations in the MYGENETOKEN gene, which encodes ferroportin, are associated with autosomal dominant MYDISEASETOKEN.
15521925	2	2	ENSP00000223051	DOID:2352	Homozygous mutations of MYGENETOKEN cause MYDISEASETOKEN, suggesting that MYGENETOKEN alpha may not be a simple iron transporter, but a regulator of iron by identifying iron-Tf.
15737883	2	8	ENSP00000222304	DOID:2352	At the opposite extreme, early studies indicate that MYGENETOKEN deficiency--due to the dysregulation of its synthesis or mutations in the MYGENETOKEN gene itself--is the immediate cause of most forms of MYDISEASETOKEN.
15319276	2	1	ENSP00000223051	DOID:2352	MYGENETOKEN (MYGENETOKEN) plays a critical role in iron homeostasis because patients carrying disabling mutations in the MYGENETOKEN gene suffer from MYDISEASETOKEN.
20231891	2	6	ENSP00000223051	DOID:2352	MYGENETOKEN null mice are a model of type 3 hereditary MYDISEASETOKEN and develop significant iron overload providing increased iron stores at the onset of infection.
27445804	2	2	ENSP00000222304	DOID:2352	MYGENETOKEN insufficiency causes hyperabsorption of dietary iron, hyperferremia and tissue iron overload, which are hallmarks of hereditary MYDISEASETOKEN.
9088667	2	1	ENSP00000250971	DOID:2352	To determine MYGENETOKEN action and MYGENETOKEN secretory function in patients with MYDISEASETOKEN, and to find evidence for or against hypothesized pathogenetic mechanisms for the abnormal glucose metabolism associated with MYDISEASETOKEN.
19907151	2	5	ENSP00000261024	DOID:2352	The second subgroup of MYDISEASETOKEN is caused by autosomal dominant mutations in the MYGENETOKEN gene encoding the iron exporter ferroportin with distinctive features.
17106152	2	4	ENSP00000337014	DOID:2352	Three patients with mutations in the MYGENETOKEN gene, MYGENETOKEN, showed also middle-age-onset MYDISEASETOKEN.
12704388	1	1	ENSP00000222304	DOID:2352	Constitutive MYGENETOKEN expression prevents iron overload in a mouse model of MYDISEASETOKEN.
12809944	2	9	ENSP00000223051	DOID:2352	Further study was undertaken to investigate whether the large deletion of the MYGENETOKEN gene is the mutation responsible for some of the Japanese MYDISEASETOKEN cases.
18762941	2	8	ENSP00000222304	DOID:2352	Concerning MYGENETOKEN, the deleterious mutation 5'UTR -25G--&gt;A was found once, associated with Juvenile MYDISEASETOKEN.
12637325	2	5	ENSP00000222304	DOID:2352	MYGENETOKEN expression correlated significantly with serum ferritin levels in controls, whereas no significant up-regulation was observed in patients with MYDISEASETOKEN despite iron-overload conditions and high serum ferritin levels.
9149941	2	1	ENSP00000366005	DOID:2352	In the process of positionally cloning a candidate gene responsible for hereditary MYDISEASETOKEN (HH), we constructed a 1.1-Mb transcript map of the region of human chromosome 6p that lies 4.5 Mb telomeric to MYGENETOKEN.
15461631	2	6	ENSP00000337014	DOID:2352	One patient with severe iron overload was found to be a compound heterozygote for MYGENETOKEN mutations, one of which had previously been identified in patients with juvenile MYDISEASETOKEN (G320V) and the other was novel (C321W).
14704284	2	6	ENSP00000222304	DOID:2352	MYGENETOKEN expression is also affected by hypoxia and inflammation and is decreased in MYDISEASETOKEN patients.
17124036	2	8	ENSP00000222304	DOID:2352	This implies that, with the exception of very rare mutations that affect the MYGENETOKEN gene itself or modify ferroportin to make it less responsive to MYGENETOKEN, MYDISEASETOKEN genes encode molecules that regulate MYGENETOKEN synthesis.
15194541	2	2	ENSP00000337014	DOID:2352	We evaluated the frequency of the most common mutation (G320V) of the MYGENETOKEN gene in the Greek population, since 50% of cases of hereditary MYDISEASETOKEN in Greece carry mutations of the MYGENETOKEN gene.
22408404	2	7	ENSP00000337014	DOID:2352	The evaluation of the MYGENETOKEN p.Gly320Val mutation must be the molecular test of choice in suspected patients with juvenile MYDISEASETOKEN with less than 30 years and cardiac or endocrine manifestations.
16099526	1	1	ENSP00000337014	DOID:2352	Three patients with middle-age-onset MYDISEASETOKEN caused by novel mutations in the MYGENETOKEN gene.
15308612	1	1	ENSP00000250971	DOID:2352	Oxidative stress, beta-cell apoptosis, and decreased MYGENETOKEN secretory capacity in mouse models of MYDISEASETOKEN.
11358390	2	17	ENSP00000223051	DOID:2352	Concurrently, none of the 18 hereditary MYDISEASETOKEN patients who had their MYGENETOKEN gene sequenced had any deleterious mutation.
294823	2	12	ENSP00000369351	DOID:2352	MYDISEASETOKEN in MYGENETOKEN occurs frequently and shortens the median survival.
15345587	2	3	ENSP00000223051	DOID:2352	We recently reported that homozygous MYGENETOKEN(Y245X) mutant mice, which correspond to the MYGENETOKEN(Y250X) mutation in humans, showed a phenotype similar to hereditary MYDISEASETOKEN.
27686443	1	1	ENSP00000261024	DOID:2352	[A novel mutation in MYGENETOKEN gene in hereditary MYDISEASETOKEN in China].
14982873	1	1	ENSP00000337014	DOID:2352	Spectrum of MYGENETOKEN gene mutations in 1q-linked juvenile MYDISEASETOKEN.
7078263	2	1	ENSP00000348564	DOID:2352	A 12-year-old girl with MYGENETOKEN, was diagnosed as having MYDISEASETOKEN.
12777185	2	5	ENSP00000308541	DOID:2352	A retrospective study using human genomic DNA samples of known genotype was performed for four different clinically relevant mutations: Factor V Leiden, Factor II MYGENETOKEN, and two MYDISEASETOKEN mutations, C282Y and H63D.
12606179	2	12	ENSP00000261024	DOID:2352	Furthermore, the increase in hepatic MYGENETOKEN expression in MYDISEASETOKEN suggests that MYGENETOKEN could function to facilitate the removal of excess iron from the liver.
16075054	2	1	ENSP00000337014	DOID:2352	Recently, mutations causing juvenile MYDISEASETOKEN have been identified in a novel gene, MYGENETOKEN (MYGENETOKEN), located on chromosome 1.
19549277	1	1	ENSP00000223051	DOID:2352	Natural history of MYGENETOKEN-related hereditary MYDISEASETOKEN in a 47-yr-old Italian patient.
16339398	2	4	ENSP00000222304	DOID:2352	We previously demonstrated that, when expressed early in fetal development, constitutive transgenic MYGENETOKEN expression prevented iron accumulation in an Hfe-/- mouse model of MYDISEASETOKEN.
12547237	1	1	ENSP00000223051	DOID:2352	MYDISEASETOKEN due to mutations in MYGENETOKEN.
22981443	1	1	ENSP00000223051	DOID:2352	Type 3 hereditary MYDISEASETOKEN in a patient from sub-Saharan Africa: is there a link between African iron overload and MYGENETOKEN dysfunction?
7666396	1	1	ENSP00000399168	DOID:2352	Allelic associations and homozygosity at loci from MYGENETOKEN to D6S299 in genetic MYDISEASETOKEN.
11231441	2	1	ENSP00000333994	DOID:2352	Cardiac MYDISEASETOKEN remains the most frequent cause of death in MYGENETOKEN.
8903392	2	1	ENSP00000348068	DOID:2352	Genetic MYDISEASETOKEN and MYGENETOKEN (AAT) deficiency are frequent in white populations.
12138110	1	1	ENSP00000222304	DOID:2352	The solution structure of human MYGENETOKEN, a peptide hormone with antimicrobial activity that is involved in iron uptake and hereditary MYDISEASETOKEN.
22306005	2	11	ENSP00000222304	DOID:2352	MYGENETOKEN deficiency causes iron overload in hereditary MYDISEASETOKEN and ineffective erythropoiesis.
26408288	1	1	ENSP00000223051	DOID:2352	MYGENETOKEN mutations in patients with juvenile MYDISEASETOKEN phenotype.
1618466	2	5	ENSP00000348068	DOID:2352	We studied 15 patients with genetic MYDISEASETOKEN. MYGENETOKEN quantitation and phenotyping were performed in each case using standard methods.
16793930	2	3	ENSP00000398698	DOID:2352	In patients with homozygous C282Y MYDISEASETOKEN, we investigated the influence of MYGENETOKEN -308G&gt;A allelic variant on total body iron overload, determined in all patients by measuring iron removed during depletion therapy, and hepatic iron index and need for phlebotomy to prevent iron reaccumulation, measured in patient subgroups.
2843458	2	1	ENSP00000366005	DOID:2352	The gene for idiopathic MYDISEASETOKEN is located on the short arm of chromosome 6 within 1 cM of the MYGENETOKEN locus.
26164493	1	1	ENSP00000222304	DOID:2352	Genetics, Genetic Testing, and Management of MYDISEASETOKEN: 15 Years Since MYGENETOKEN.
16075059	2	4	ENSP00000222304	DOID:2352	Juvenile MYDISEASETOKEN patients have decreased urinary levels of MYGENETOKEN, a peptide hormone that binds to the cellular iron exporter ferroportin, causing its internalization and degradation.
18160816	2	10	ENSP00000261024	DOID:2352	We conclude that this patient represents a unique example of MYDISEASETOKEN due to a single base-pair mutation of MYGENETOKEN that results in aberrant splicing and truncation of ferroportin.
21173098	2	1	ENSP00000222304	DOID:2352	Inadequate MYGENETOKEN production leads to iron overload in nearly all types of MYDISEASETOKEN.
24295741	2	6	ENSP00000222304	DOID:2352	Differences in the sequence of the portion of the MYGENETOKEN gene that encodes the mature peptide that might account for the increased susceptibility of the Egyptian fruit bat to MYDISEASETOKEN were not identified.
16793930	2	9	ENSP00000398698	DOID:2352	MYGENETOKEN -308G&gt;A allelic variant modulates iron accumulation in patients with hereditary (homozygous C282Y) MYDISEASETOKEN, but the effect of the MYGENETOKEN -308A allele on clinical manifestations of MYDISEASETOKEN was less accentuated than expected from the increased iron load associated with this allele.
15317665	2	2	ENSP00000223051	DOID:2352	Mutations in MYGENETOKEN result in MYDISEASETOKEN, indicating that this receptor has a unique role in iron metabolism.
26077449	2	3	ENSP00000337014	DOID:2352	Using a genetic MYDISEASETOKEN (MYGENETOKEN knockout mice) and non-genetic (secondary iron-overload) murine models of hepatic iron-overload, we elucidated the mechanism of hepatic iron injury and the therapeutic effects of resveratrol.
15749661	2	13	ENSP00000223051	DOID:2352	Taken together with the previous report, 5 of our 12 patients with MYDISEASETOKEN manifesting in middle age had mutations in the MYGENETOKEN gene.
26669208	2	2	ENSP00000222304	DOID:2352	Dysregulation of MYGENETOKEN leads to altered iron homeostasis and development of pathological disorders including MYDISEASETOKEN, and iron loading and iron restrictive anemias.
20533066	1	1	ENSP00000222304	DOID:2352	Measurement of serum MYGENETOKEN-25 levels as a potential test for diagnosing MYDISEASETOKEN and related disorders.
7615285	1	1	ENSP00000348068	DOID:2352	Increased PiZ gene frequency for MYGENETOKEN in patients with genetic MYDISEASETOKEN.
17551401	1	1	ENSP00000333994	DOID:2352	Magnetic resonance imaging (MRI) findings of joints in young MYGENETOKEN patients: fluid surrounding the scaphoid bone: a novel finding, as the possible effect of secondary MYDISEASETOKEN.
