25700349	2	5	ENSP00000417404	DOID:2352	We previously discovered that the MYDISEASETOKEN protein MYGENETOKEN, a negative regulator of iron absorption, dampens classical MHC I antigen presentation.
24055163	1	1	ENSP00000223051	DOID:2352	MYGENETOKEN-related hereditary MYDISEASETOKEN as a frequent cause of primary iron overload in patients from Central-Southern Italy.
28110135	1	1	ENSP00000261024	DOID:2352	Identification of hereditary MYDISEASETOKEN pedigrees and a novel MYGENETOKEN mutation in Chinese population.
21054916	2	10	ENSP00000222304	DOID:2352	Recent advances in our understanding of MYGENETOKEN and body iron homeostasis provide the potential for a range of new diagnostic and therapeutic tools for MYDISEASETOKEN and related conditions.
23651749	2	2	ENSP00000417404	DOID:2352	In Caucasians, mutations in the MYGENETOKEN-gene account for the most common form of MYDISEASETOKEN (type 1).
22897067	2	11	ENSP00000222304	DOID:2352	In the setting of MYDISEASETOKEN, it has been suggested that MYGENETOKEN could be useful to stratify molecular testing, or to optimize the frequency of phlebotomies, but this remains to be investigated.
10772870	2	4	ENSP00000417404	DOID:2352	To date, there are no published data on the cellular location and regulation of MYGENETOKEN in patients with MYDISEASETOKEN who are homozygous for C282Y.
16545687	1	1	ENSP00000417404	DOID:2352	Increased urinary excretion of 8-iso-prostaglandin F2alpha in patients with MYGENETOKEN-related MYDISEASETOKEN: a case-control study.
9620340	2	2	ENSP00000417404	DOID:2352	Recently, PCT has also been associated with mutations in the MYGENETOKEN gene that are associated with HLA-linked hereditary MYDISEASETOKEN.
26418842	1	1	ENSP00000355607	DOID:2352	Further support for the association of MYGENETOKEN variant rs11558492 with severe iron overload in MYDISEASETOKEN.
24653703	1	1	ENSP00000417404	DOID:2352	Molecular basis of MYGENETOKEN-MYDISEASETOKEN.
14618419	2	2	ENSP00000417404	DOID:2352	C282Y and H63D mutations in the MYDISEASETOKEN (MYGENETOKEN) gene are associated with increased serum iron levels and consequently with hereditary MYDISEASETOKEN.
11313312	1	1	ENSP00000417404	DOID:2352	Intestinal iron uptake determined by divalent metal transporter is enhanced in MYGENETOKEN-deficient mice with MYDISEASETOKEN.
25776452	2	1	ENSP00000417404	DOID:2352	The treatment of MYGENETOKEN-related MYDISEASETOKEN, one of the most common genetic diseases, is based on phlebotomies whose tolerance is evaluated by regular monitoring of hemoglobin.
23678850	2	6	ENSP00000417404	DOID:2352	The association between haemosiderin counts and degenerative and vascular brain pathology, clinical data, and the MYDISEASETOKEN (MYGENETOKEN) gene H63D genotype were analysed.
12673276	2	14	ENSP00000417404	DOID:2352	Our study shows that the MYGENETOKEN C282Y and H63D are determinants of iron parameters in the elderly and will be effective in detecting individuals at high risk of MYDISEASETOKEN.
12508966	1	1	ENSP00000417404	DOID:2352	Clinical relevance of MYDISEASETOKEN-related MYGENETOKEN C282Y/H63D gene mutations in patients on chronic dialysis.
18752323	2	2	ENSP00000417404	DOID:2352	"This article provides an update of recent developments and key issues relating to iron homeostasis and inherited disorders of iron overload, with emphasis on MYGENETOKEN-related HH, and is based on the content of the American Association for the Study of Liver Diseases Single-Topic Conference entitled ""MYDISEASETOKEN: What has Happened After MYGENETOKEN?"" which was held at the Emory Convention Center in Atlanta, September 7-9, 2007."
11078891	2	2	ENSP00000417404	DOID:2352	In this report we demonstrate that the predominant hereditary MYDISEASETOKEN mutation, C282Y(2) MYGENETOKEN, does not reduce ferritin expression.
9385688	1	1	ENSP00000417404	DOID:2352	Genetic MYDISEASETOKEN: why is discovery of the MYGENETOKEN gene of interest to rheumatologists?
25654085	2	4	ENSP00000417404	DOID:2352	Two groups were characterized: C282Y/C282Y or C282Y/H63D genotypes (n = 16) were the MYGENETOKEN hereditary MYDISEASETOKEN (MYGENETOKEN-HH) group; and C282Y and H63D single heterozygotes, the H63D/H63D genotype, and wild-type were considered group 2 (n = 92).
15990686	2	2	ENSP00000417404	DOID:2352	The C282Y and H63D mutations in the MYDISEASETOKEN (MYGENETOKEN) gene are associated with increased serum iron levels and net iron accumulation.
91216	2	1	ENSP00000366005	DOID:2352	MYGENETOKEN and B antigens were defined in 154 unrelated idiopathic MYDISEASETOKEN patients.
22796612	1	1	ENSP00000417404	DOID:2352	[Hereditary MYDISEASETOKEN MYGENETOKEN: regulatory and economic aspects of diagnosis and medical management].
19700664	2	1	ENSP00000417404	DOID:2352	Mutations of MYGENETOKEN are associated with hereditary MYDISEASETOKEN, but their influence on host susceptibility to infection is incompletely understood.
15951546	2	8	ENSP00000223051	DOID:2352	Homozygous MYGENETOKEN-KO mice had no MYGENETOKEN protein expression and developed significant iron overload typical of MYGENETOKEN associated MYDISEASETOKEN.
15671444	2	3	ENSP00000417404	DOID:2352	The aim of the present study was to quantify LPI in MYGENETOKEN genetic MYDISEASETOKEN (GH) and to characterize the mechanisms accounting for its appearance.
18624620	2	1	ENSP00000417404	DOID:2352	Genetic predisposition to MYDISEASETOKEN involves several different point mutations in the MYGENETOKEN gene.
10073265	2	2	ENSP00000417404	DOID:2352	The MYDISEASETOKEN gene (MYGENETOKEN) was identified by positional cloning in 1996.
17689879	2	3	ENSP00000417404	DOID:2352	I propose that hereditary MYDISEASETOKEN and in particular the common MYGENETOKEN C282Y mutation may represent an adaptation to decreased dietary iron in cereal grain-based Neolithic diets.
19008010	2	3	ENSP00000417404	DOID:2352	Data on MYGENETOKEN-genotype, iron parameters, demographics, lifestyle factors and health, were collected from 224 Dutch C282Y homozygous patients with clinically diagnosed HH and 735 of their first-degree family members (FDFM), all participating in the MYDISEASETOKEN FAmily Study (HEFAS).
10660483	2	1	ENSP00000417404	DOID:2352	Two amino acid variants in the MYGENETOKEN gene, C282Y and H63D, have been reported in most cases of hereditary MYDISEASETOKEN.
16533407	2	2	ENSP00000417404	DOID:2352	Twenty-eight percent of 80 Alabama white MYDISEASETOKEN probands with MYGENETOKEN C282Y homozygosity previously reported having Native American ancestry, but the possible effect of this ancestry on MYDISEASETOKEN phenotypes was unknown.
23582421	2	11	ENSP00000362207	DOID:2352	MYGENETOKEN:HHCL rats are the first genetic rat model of hereditary MYDISEASETOKEN and may prove useful for understanding the molecular mechanisms underlying the regulation of iron metabolism.
15993396	1	1	ENSP00000417404	DOID:2352	Beware of multiple comparisons: a study of symptoms associated with mutations of the MYGENETOKEN MYDISEASETOKEN gene.
18363869	2	1	ENSP00000417404	DOID:2352	The MYDISEASETOKEN mutation, C282Y of the MYGENETOKEN gene, seems to have originated from a single event which once occurred in a person living in the north west of Europe carrying human leukocyte antigen (HLA)-A3-B7.
11313241	2	1	ENSP00000417404	DOID:2352	Hereditary MYDISEASETOKEN usually results from C282Y homozygosity in the MYGENETOKEN gene on chromosome 6p.
16081371	2	6	ENSP00000222304	DOID:2352	Patients carrying mutations in these molecules or in MYGENETOKEN itself develop systemic iron loading (or MYDISEASETOKEN) due to their inability to down regulate iron absorption.
23049448	2	2	ENSP00000417404	DOID:2352	However, since 1996, it is known that MYGENETOKEN mutations explain about 80% of HH cases, with the remaining around 20% denominated non-MYGENETOKEN MYDISEASETOKEN.
12809944	2	5	ENSP00000223051	DOID:2352	Therefore, we investigated the MYGENETOKEN gene of 6 sporadic and 5 familiar cases of Japanese MYDISEASETOKEN.
12737949	1	1	ENSP00000417404	DOID:2352	MYDISEASETOKEN gene (MYGENETOKEN) mutations in South East Asia: a potential for iron overload.
17098454	1	1	ENSP00000417404	DOID:2352	Hepatic iron metabolism gene expression profiles in MYGENETOKEN associated hereditary MYDISEASETOKEN.
17597476	1	1	ENSP00000417404	DOID:2352	Determinants and characteristics of mean corpuscular volume and hemoglobin concentration in white MYGENETOKEN C282Y homozygotes in the MYDISEASETOKEN and iron overload screening study.
12547214	2	1	ENSP00000417404	DOID:2352	MYGENETOKEN-associated hereditary MYDISEASETOKEN is characterized by imbalances of iron homeostasis and alterations in intestinal iron absorption.
15925529	1	1	ENSP00000417404	DOID:2352	[MYGENETOKEN MYDISEASETOKEN: pathogenic and diagnostic approach].
12714262	2	1	ENSP00000417404	DOID:2352	Mutations in the class I-like Major Histocompatibility Complex gene MYGENETOKEN are associated with hereditary MYDISEASETOKEN (HH), a disorder caused by excessive iron uptake.
23953397	2	1	ENSP00000417404	DOID:2352	Most adults affected with hereditary MYDISEASETOKEN are homozygous for a single point mutation of MYGENETOKEN (p.Cys282Tyr).
16368718	2	4	ENSP00000417404	DOID:2352	Measured by a recently developed high-throughput fluorescence-based assay, serum NTBI was found to be higher in both homozygotes of MYGENETOKEN C282Y mutation of hereditary MYDISEASETOKEN (7.9+/-0.6 microM, n=9, P&lt;0.001) and heterozygotes (4.0+/-0.5 microM, n=8, P&lt;0.001), compared with controls (1.6+/-0.2 microM, n=21).
9373599	2	2	ENSP00000417404	DOID:2352	A candidate gene for hereditary MYDISEASETOKEN has recently been reported (MYGENETOKEN) and a specific missense mutation (Cys282Tyr) has been identified in 85% of patients with the disorder.
24319245	2	1	ENSP00000417404	DOID:2352	Hereditary MYDISEASETOKEN (HH) due to homozygosity for the C282Y mutation in the MYGENETOKEN gene is a common inherited iron overload disorder in whites of northern European descent.
10424282	2	7	ENSP00000219070	DOID:2352	Serum type IV collagen concentration was significantly increased in MYDISEASETOKEN patients compared to controls (130+/-79 ng/ml vs 81 +/- 17 ng/ml, p&lt;0.05) and was significantly correlated with both the grade of histological fibrosis (r=0.67, p&lt;0.0001) and serum MYGENETOKEN levels (r=0.42, p&lt;0.05).
17053738	2	11	ENSP00000417404	DOID:2352	The absence of C282Y mutation (MYGENETOKEN gene) ruled out a diagnosis of genetic MYDISEASETOKEN.
9021970	1	1	ENSP00000417404	DOID:2352	"MYDISEASETOKEN and ""MYGENETOKEN"": definite!"
17710673	2	2	ENSP00000417404	DOID:2352	Most cases are homozygous for the C282Y mutation in the MYGENETOKEN gene, but only a minority of homozygotes will ever suffer from clinical MYDISEASETOKEN.
18657084	2	9	ENSP00000417404	DOID:2352	Mutations in MYGENETOKEN associated with MYDISEASETOKEN were present in superdonors at the same frequency as the normal population.
11205685	1	1	ENSP00000417404	DOID:2352	MYDISEASETOKEN: automated detection of the two point mutations in the MYGENETOKEN gene: Cys282Tyr and His63Asp.
17943492	2	2	ENSP00000417404	DOID:2352	A decade has passed since the discovery of the MYDISEASETOKEN gene, MYGENETOKEN, and our understanding of hereditary MYDISEASETOKEN (HH) and iron metabolism in health and a variety of diseases has progressed considerably.
10811057	2	4	ENSP00000333994	DOID:2352	However, the correlation between ferritin iron concentration and individual liver iron concentration was poor in patients with MYDISEASETOKEN (r = 0.63) and patients with MYGENETOKEN (r = 0.57).
10216143	2	6	ENSP00000417404	DOID:2352	"Our results point to genetic forms of MYDISEASETOKEN not associated with MYGENETOKEN and raise the problem of whether non-MYGENETOKEN MYDISEASETOKEN in Italy is related to the ""juvenile"" form."
16419611	2	3	ENSP00000417404	DOID:2352	In 1996 the gene responsible for MYDISEASETOKEN was detected--the MYGENETOKEN gene and its major mutation C282Y.
12059121	2	9	ENSP00000417404	DOID:2352	Results of this study indicate that many of the symptoms associated with MYDISEASETOKEN are common among MYGENETOKEN wild types and that clinical penetrance of the C282Y/C282Y genotype in regard to these symptoms is low.
10084283	2	2	ENSP00000417404	DOID:2352	One example is the discovery of the MYGENETOKEN gene that is mutated in patients suffering from hereditary MYDISEASETOKEN.
12145827	1	1	ENSP00000417404	DOID:2352	Differential MYGENETOKEN allele expression in MYDISEASETOKEN heterozygotes.
14633776	2	9	ENSP00000417404	DOID:2352	Evidence regarding the biochemical and clinical penetrance of MYDISEASETOKEN due to mutations of the MYGENETOKEN gene is rapidly accumulating.
19008010	1	1	ENSP00000417404	DOID:2352	Severity of iron overload of proband determines serum ferritin levels in families with MYGENETOKEN-related MYDISEASETOKEN: the MYDISEASETOKEN FAmily Study.
10205270	2	2	ENSP00000417404	DOID:2352	Affected members in families with JH do not show linkage to chromosome 6p and do not have mutations in the MYGENETOKEN gene that lead to the common hereditary MYDISEASETOKEN.
10575542	1	1	ENSP00000417404	DOID:2352	Haplotype analysis of the MYGENETOKEN gene: implications for the origins of MYDISEASETOKEN related mutations.
17373275	2	3	ENSP00000417404	DOID:2352	The MYGENETOKEN C282Y +/+ mutation is responsible for the most frequent type of MYDISEASETOKEN in France.
9931446	1	1	ENSP00000417404	DOID:2352	Cloning, sequencing and characterization of the rat hereditary MYDISEASETOKEN promoter: comparison of the human, mouse and rat MYGENETOKEN promoter regions.
14633776	2	7	ENSP00000222304	DOID:2352	A more severe, juvenile form of MYDISEASETOKEN results from mutations of the gene encoding MYGENETOKEN or of a not-yet-identified gene on chromosome 1q.
28358914	2	1	ENSP00000417404	DOID:2352	Human MYDISEASETOKEN protein (MYGENETOKEN) is involved in iron metabolism.
11436126	2	1	ENSP00000417404	DOID:2352	Hereditary MYDISEASETOKEN is an inherited disorder characterised by an excessive iron absorption from the diet and is associated with several MYGENETOKEN gene mutations.
12547233	1	1	ENSP00000261024	DOID:2352	Dominant MYDISEASETOKEN due to N144H mutation of MYGENETOKEN: clinical and biological characteristics.
16216474	1	1	ENSP00000417404	DOID:2352	Frequency of MYDISEASETOKEN gene (MYGENETOKEN) mutations in Russian healthy women and patients with estrogen-dependent cancers.
17729390	2	1	ENSP00000417404	DOID:2352	Non-MYGENETOKEN hereditary MYDISEASETOKEN (HH) refers to a genetically heterogeneous group of iron overload disorders that are unlinked to mutations in the MYGENETOKEN gene.
11358390	2	5	ENSP00000223051	DOID:2352	25, 14-15, 2000) identified a stop mutation (exon 6 nt 750 C --&gt; T, Y250X) on the MYGENETOKEN (MYGENETOKEN) gene in two unrelated Sicilian families with hereditary MYDISEASETOKEN.
22362121	2	2	ENSP00000417404	DOID:2352	The presence of MYDISEASETOKEN gene (MYGENETOKEN) mutations might exacerbate iron toxicity in the post-transplant setting.
14648375	2	1	ENSP00000417404	DOID:2352	MYDISEASETOKEN is usually inherited in an autosomal recessive mode and associated with missense mutations in the MYDISEASETOKEN gene (MYGENETOKEN), an HLA class 1 related gene.
11686223	1	1	ENSP00000417404	DOID:2352	Mutation analysis of the MYGENETOKEN gene in German MYDISEASETOKEN patients and controls using automated SSCP-based capillary electrophoresis and a new PCR-ELISA technique.
11722599	2	9	ENSP00000417404	DOID:2352	These results suggest that a lower peripheral blood lymphocyte count is associated with a greater degree of iron loading in MYGENETOKEN MYDISEASETOKEN but not in African iron overload, and they support the notion that the lymphocyte count may serve as a marker of a non-MYGENETOKEN gene that influences the clinical expression of MYGENETOKEN MYDISEASETOKEN.
17002922	2	1	ENSP00000417404	DOID:2352	Homozygosity for the C282Y mutation of the MYDISEASETOKEN gene on chromosome 6p (MYGENETOKEN) is a common genetic trait that increases susceptibility to iron overload.
16848710	2	6	ENSP00000222304	DOID:2352	At the opposite side of the spectrum, MYGENETOKEN deficiency appears to be the ultimate cause of most forms of MYDISEASETOKEN, either due to mutations in the MYGENETOKEN gene itself or due to mutations in the regulators of MYGENETOKEN synthesis.
12482411	2	14	ENSP00000417404	DOID:2352	The present cases do not have MYGENETOKEN genotypes typical of MYDISEASETOKEN diagnosed in adults.
25015053	1	1	ENSP00000417404	DOID:2352	MYGENETOKEN-related MYDISEASETOKEN risk mutations  in Latvian population.
18363869	2	6	ENSP00000417404	DOID:2352	HLA haplotypes and MYGENETOKEN mutations were studied in MYDISEASETOKEN patients with present or past parental origin in a sparsely populated (1/km(2)) rural district (n = 8366 in the year of 2005), in central Sweden.
11478357	2	1	ENSP00000417404	DOID:2352	MYDISEASETOKEN associated with mutations in the MYGENETOKEN gene is the most common inherited disorder in Caucasian populations.
17289614	2	7	ENSP00000417404	DOID:2352	Some data support the possibility that these common forms of hereditary MYDISEASETOKEN mutation (MYGENETOKEN-C282Y and MYGENETOKEN-H63D)--even in the heterozygote form--elevate the tissue level of iron without manifesting the phenotype of classical hereditary MYDISEASETOKEN.
9328324	1	1	ENSP00000417404	DOID:2352	Clinical and family studies in genetic MYDISEASETOKEN: microsatellite and MYGENETOKEN studies in five atypical families.
17376729	2	3	ENSP00000417404	DOID:2352	MYGENETOKEN-deficient mice develop iron overload indicating a central role of the protein in the pathogenesis of hereditary MYDISEASETOKEN type I.
14614395	2	1	ENSP00000417404	DOID:2352	The purpose of this study was to estimate analytic sensitivity and specificity of MYGENETOKEN testing for C282Y homozygosity in the hypothetical setting of population screening for MYDISEASETOKEN.
10348824	2	1	ENSP00000417404	DOID:2352	Most patients with genetic MYDISEASETOKEN are homozygous for a single mutation of the MYGENETOKEN gene (C282Y).
15610558	2	5	ENSP00000337014	DOID:2352	We evaluated the genomic DNA of 241 Alabama white and 124 African American adults who reported no history of MYDISEASETOKEN or iron overload to detect MYGENETOKEN missense mutations I222N and G320V using polymerase chain reaction-restriction fragment length polymorphism (PCR-RFLP) technique.
10930379	2	1	ENSP00000417404	DOID:2352	Most MYDISEASETOKEN patients of Northern European descent are homozygous for the C282Y mutation of MYGENETOKEN gene.
17106152	2	2	ENSP00000417404	DOID:2352	The major mutation of MYDISEASETOKEN in Celtic ancestry, C282Y of MYGENETOKEN, was reported in a Japanese patient.
10832943	1	1	ENSP00000417404	DOID:2352	Use of MYGENETOKEN mutation analysis for hereditary MYDISEASETOKEN: the need for physician education in the translation of basic science to clinical practice.
25737209	2	7	ENSP00000222304	DOID:2352	The update on MYGENETOKEN centered mechanisms of iron metabolism and their clinical perspective in MYDISEASETOKEN will be discussed in this review.
22674401	2	7	ENSP00000417404	DOID:2352	After the introduction of the MYGENETOKEN genetic test an earlier diagnosis after first onset of MYDISEASETOKEN-associated clinical features was observed between 2006 and 2009 vs.
17540536	2	1	ENSP00000417404	DOID:2352	Hereditary iron overload is mainly due to mutations of the MYGENETOKEN gene, implicated in most cases of hereditary MYDISEASETOKEN.
12707220	1	1	ENSP00000417404	DOID:2352	The MYGENETOKEN Cys282Tyr mutation as a necessary but not sufficient cause of clinical hereditary MYDISEASETOKEN.
22504868	2	1	ENSP00000417404	DOID:2352	Mutations in the MYDISEASETOKEN gene (MYGENETOKEN) influence iron status in the general population of Northern Europe, and excess iron is associated with the impairment of spermatogenesis.
16417669	2	6	ENSP00000385638	DOID:2352	One or more MRC complex activities (expressed as ratios relative to citrate synthase and/or complex II activity) were less than 50% of control mean activity in 11/20 patients (including patients with deficiencies of pyruvate dehydrogenase complex, pantothenate kinase, holocarboxylase synthetase, long-chain MYGENETOKEN, molybdenum co-factor, and neonatal MYDISEASETOKEN).
19058322	1	1	ENSP00000417404	DOID:2352	Function of the MYDISEASETOKEN protein MYGENETOKEN: Lessons from animal models.
11313312	2	1	ENSP00000417404	DOID:2352	Overexpression of duodenal divalent metal transporter (DMT1) messenger RNA occurs in MYDISEASETOKEN and MYGENETOKEN-knockout mice, suggesting that DMT1 mediates enhanced absorption of iron; however, increased expression of functional DMT1 protein has yet to be substantiated.
24282517	2	1	ENSP00000417404	DOID:2352	Hereditary MYDISEASETOKEN (HH) is a recessively inherited disorder of iron overload occurring commonly in subjects homozygous for the C282Y mutation in MYGENETOKEN gene localized on chromosome 6p21.3 in linkage disequilibrium with the human leukocyte antigen (HLA)-A locus.
14635204	2	1	ENSP00000417404	DOID:2352	Three polymorphic gene mutations in the human MYDISEASETOKEN (MYGENETOKEN) gene (C282Y, H63D, S65C) are associated with non-transfusion-related iron overload in Caucasians.
12714823	2	1	ENSP00000417404	DOID:2352	The frequencies of the hereditary MYDISEASETOKEN gene (MYGENETOKEN) mutations C282Y and H63D vary between different populations.
12902032	2	2	ENSP00000417404	DOID:2352	We studied the role of mutations in the MYDISEASETOKEN gene MYGENETOKEN in PD and other parkinsonism (non-PD PS) in two population-based series.
16868025	2	2	ENSP00000337014	DOID:2352	Mutations in this gene have been linked to the severe MYDISEASETOKEN, juvenile MYDISEASETOKEN, although the mechanisms of action of MYGENETOKEN in iron metabolism are unknown.
17945001	2	1	ENSP00000417404	DOID:2352	MYGENETOKEN disruption in mouse leads to experimental MYDISEASETOKEN by a mechanism that remains elusive.
20979574	1	3	ENSP00000417404	DOID:2352	They received brief information on MYGENETOKEN-HH and were assessed for the signs and symptoms of MYDISEASETOKEN.
12714823	1	1	ENSP00000417404	DOID:2352	Prevalence of MYDISEASETOKEN gene (MYGENETOKEN) mutations in Greece.
25075539	2	3	ENSP00000417404	DOID:2352	Most human hereditary MYDISEASETOKEN cases (up to 90%) are caused by a point mutation in the MYGENETOKEN gene, resulting in a C282Y substitution leading to iron accumulation.
12712916	2	2	ENSP00000417404	DOID:2352	The aim of this study was to specify the relationship between iron overload, polymetabolic syndrome, MYGENETOKEN mutations of primary MYDISEASETOKEN and steatosis.
17194693	1	1	ENSP00000417404	DOID:2352	Consequences of expressing mutants of the MYDISEASETOKEN gene (MYGENETOKEN) into a human neuronal cell line lacking endogenous MYGENETOKEN.
21959608	2	2	ENSP00000417404	DOID:2352	It is characterized by a variable prevalence of mutations in the MYDISEASETOKEN gene (MYGENETOKEN) in different countries and a complex relationship between the MYGENETOKEN genotype and the HH phenotype.
19589941	1	1	ENSP00000222304	DOID:2352	Hereditary MYDISEASETOKEN due to resistance to MYGENETOKEN: high MYGENETOKEN concentrations in a family with C326S ferroportin mutation.
10491369	2	1	ENSP00000417404	DOID:2352	Background-The genetic background of hereditary MYDISEASETOKEN (HH) is homozygosity for a cysteine-to-tyrosine transition at position 282 in the MYGENETOKEN gene.
24368960	2	12	ENSP00000417404	DOID:2352	The MYGENETOKEN gene H63D mutation underlies Hereditary MYDISEASETOKEN (HH), which needs treatment to prevent organ damages by iron overload.
16138214	1	1	ENSP00000417404	DOID:2352	MYDISEASETOKEN (MYGENETOKEN) gene mutations in Brazilian chronic hemodialysis patients.
11199371	1	2	ENSP00000417404	DOID:2352	Excessive oral iron intake may lead to secondary MYDISEASETOKEN even in MYGENETOKEN C282Y mutation negative subjects.
19453575	2	3	ENSP00000417404	DOID:2352	It was reported that individual immunological profile of CD8+ T-lymphocytes may have a modifying effect on the severity of iron overload in MYGENETOKEN homozygous MYDISEASETOKEN patients, with low numbers being negatively correlated with the total amount of body iron stores.
17019598	2	11	ENSP00000250971	DOID:2352	MYGENETOKEN secretory capacity improves after normalisation of iron stores in subjects with hereditary MYDISEASETOKEN.
19667680	2	4	ENSP00000222304	DOID:2352	Dr Andrews also examines the link between ACD and hereditary MYDISEASETOKEN, 2 disorders that on the surface may seem quite different but have in common the involvement of MYGENETOKEN in their pathogenesis.
11379346	2	4	ENSP00000342267	DOID:2352	Heterozygotes were identified by mailing individuals homozygous for hereditary MYDISEASETOKEN questionnaires concerning the number of siblings born alive and the number of miscarriages suffered by their mothers (predominantly heterozygotes, or MYGENETOKEN).
28115312	2	4	ENSP00000337014	DOID:2352	Male and female wild-type and MYGENETOKEN-null mice were injected and fed with a high-iron diet, respectively, to develop secondary iron overload and genetic MYDISEASETOKEN.
6381191	2	5	ENSP00000250971	DOID:2352	MYGENETOKEN concentrations increased to significantly higher levels in patients with idiopathic MYDISEASETOKEN than in the control subjects from 30 to 180 min after the glucose load (p less than or equal to 0.01), while fasting MYGENETOKEN concentrations were not significantly different (p greater than 0.05).
19796184	1	1	ENSP00000337014	DOID:2352	Juvenile MYDISEASETOKEN due to homozygosity for the G320V mutation in the MYGENETOKEN gene with fatal outcome.
19400694	2	4	ENSP00000222304	DOID:2352	Except for inherited defects of ferroportin and MYGENETOKEN itself, all forms of MYDISEASETOKEN appear to arise from MYGENETOKEN dysregulation.
27007796	1	1	ENSP00000222304	DOID:2352	MYGENETOKEN Gene Mutation Associated with Juvenile MYDISEASETOKEN in Brazilian Patients.
19399775	2	2	ENSP00000222304	DOID:2352	MYGENETOKEN concentrations are increased in inflammation and suppressed in MYDISEASETOKEN.
