15254010	1	1	ENSP00000337014	DOID:2352	The recently identified type 2A juvenile MYDISEASETOKEN gene (MYGENETOKEN), a second candidate modifier of the C282Y homozygous phenotype.
16075059	2	2	ENSP00000337014	DOID:2352	Mutations in MYGENETOKEN (MYGENETOKEN) cause severe, early-onset juvenile MYDISEASETOKEN.
26027705	2	3	ENSP00000337014	DOID:2352	MYGENETOKEN (HVJ) is a membrane-bound and soluble protein in mammals that is responsible for the iron overload condition known as juvenile MYDISEASETOKEN.
21136275	2	10	ENSP00000222304	DOID:2352	The assay distinguished low MYGENETOKEN level in HCV and homozygous MYDISEASETOKEN patients from normal-range controls and compound heterozygous MYDISEASETOKEN patients.
14224103	1	1	ENSP00000369351	DOID:2352	[MYDISEASETOKEN CAUSED BY SIDEROBLASTIC MYGENETOKEN OF THE BJOERKMAN VARIETY].
23582421	1	1	ENSP00000223051	DOID:2352	A novel rat model of hereditary MYDISEASETOKEN due to a mutation in MYGENETOKEN.
21841161	2	3	ENSP00000222304	DOID:2352	A relative deficiency of MYGENETOKEN underlies the pathophysiology of many of the genetically distinct iron overload disorders, collectively termed hereditary MYDISEASETOKEN.
15897636	2	5	ENSP00000261024	DOID:2352	It was suggested that the mutation in the MYGENETOKEN may be related to MYDISEASETOKEN of this patient.
21675259	2	7	ENSP00000308541	DOID:2352	By one-factor analysis, VTEC was associated with carriage of three heterozygous genotypes: V Leiden factor (p &lt; 0.001), MYGENETOKEN (p = 0.052) and MYDISEASETOKEN (p = 0.048).
15198949	2	4	ENSP00000222304	DOID:2352	We report the detection of a new mutation in the MYGENETOKEN gene leading to juvenile MYDISEASETOKEN in 2 members of a Portuguese family.
26608187	2	5	ENSP00000223051	DOID:2352	Studies from our laboratory have shown that mice with a hepatocyte-specific deletion of MYGENETOKEN recapitulate the MYDISEASETOKEN phenotype of the global MYGENETOKEN knockout mice, suggesting that the hepatic expression of MYGENETOKEN is important in systemic iron homeostasis.
7106343	2	3	ENSP00000250971	DOID:2352	Among the twenty-eight subjects with MYDISEASETOKEN, thirty-two non-diabetics, twenty-six insulin-dependent diabetics, and twenty-four non-MYGENETOKEN-treated diabetics, we observed that the more frequently venesection therapy was performed, the lower the levels of haemoglobin HbAIc, HbAIa+b tended to be.
18951868	2	9	ENSP00000222304	DOID:2352	Urinary MYGENETOKEN levels of 3 to 9 nmol/mmol creatinine(-1) were found in healthy controls, with reduced levels in MYDISEASETOKEN (P&lt;0.00006) and elevated levels in inflammation (P&lt;0.00035).
15521925	2	7	ENSP00000223051	DOID:2352	Furthermore, we demonstrated that mutated MYGENETOKEN alpha (Y250X), which has been reported in patients with hereditary MYDISEASETOKEN, also lost its ability to interact with both human and bovine Tf.
11518736	1	1	ENSP00000261024	DOID:2352	Autosomal-dominant MYDISEASETOKEN is associated with a mutation in the ferroportin (MYGENETOKEN) gene.
15003819	2	10	ENSP00000222304	DOID:2352	They suggest that sex and genetic background, which are regulators of MYGENETOKEN expression, could play a role in the phenotypic expression of genetic MYDISEASETOKEN.
1349563	2	6	ENSP00000366005	DOID:2352	The results suggest two possible locations for the MYDISEASETOKEN gene: less than 100 kb centromeric to the MYGENETOKEN locus, or on the telomeric side.
19287179	2	1	ENSP00000337014	DOID:2352	MYGENETOKEN (MYGENETOKEN) is a membrane protein that is responsible for the iron overload condition known as juvenile MYDISEASETOKEN.
17488680	2	4	ENSP00000222304	DOID:2352	MYGENETOKEN deficiency is the cause of iron overload in most forms of hereditary MYDISEASETOKEN.
15461631	1	1	ENSP00000337014	DOID:2352	MYGENETOKEN (MYGENETOKEN) mutations in persons of European, African-American and Asian ancestry with adult onset MYDISEASETOKEN.
15956209	2	1	ENSP00000261024	DOID:2352	Mutations in the iron exporter ferroportin (Fpn) (MYGENETOKEN, MYGENETOKEN, and MYGENETOKEN) result in MYDISEASETOKEN type IV, a disorder with a dominant genetic pattern of inheritance and heterogeneous clinical presentation.
26142326	2	1	ENSP00000222304	DOID:2352	Iron overload coupled with low MYGENETOKEN levels are characteristics of hereditary MYDISEASETOKEN.
17551401	2	3	ENSP00000333994	DOID:2352	The aim of this study is to determine the possible effects of secondary MYDISEASETOKEN in joints of MYGENETOKEN patients, and to evaluate the sensitivity of magnetic resonance imaging (MRI) compared with plain x-ray, in the early diagnosis of MYDISEASETOKEN of the joints.
16166168	2	3	ENSP00000308541	DOID:2352	We compared WB-RTD PCR with the method for extracted DNA-RTD PCR for the detection of mutations in the MYGENETOKEN (n = 94), factor V Leiden (n = 49), and MYDISEASETOKEN (n = 22) genes.
12382199	2	5	ENSP00000309845	DOID:2352	The type 2 MYDISEASETOKEN locus maps to chromosome MYGENETOKEN, but the gene has not yet been isolated.
17768121	2	1	ENSP00000337014	DOID:2352	In the present study, we correlate homozygosity for the very recently identified MYGENETOKEN p.R176C substitution with a juvenile MYDISEASETOKEN phenotype.
3460331	2	8	ENSP00000399168	DOID:2352	This is the first known example of recombination in an individual with HLA-linked MYDISEASETOKEN in whom the MYDISEASETOKEN allele appeared to segregate with the MYGENETOKEN antigen instead of the -A antigen.
7336414	2	2	ENSP00000366005	DOID:2352	The previously known strong association with A3 was confirmed (RR = 10.6, P less 10(-9)) and our results indicate clearly that a gene implicated in idiopathic MYDISEASETOKEN (IH) determinism is located in the MYGENETOKEN region.
18245657	1	1	ENSP00000223051	DOID:2352	New MYGENETOKEN mutations in young Italian patients with MYDISEASETOKEN.
8304341	2	2	ENSP00000366005	DOID:2352	In an effort to identify candidate genes for MYDISEASETOKEN, this technique was applied to a 320-kb YAC containing the MYGENETOKEN gene.
17997113	1	1	ENSP00000261024	DOID:2352	Analysis of MYGENETOKEN gene at the mRNA level reveals rapidly the causative mutations in patients with hereditary MYDISEASETOKEN type IV.
18045552	2	10	ENSP00000320866	DOID:2352	In C282Y(+/+) patients MYGENETOKEN levels correlated with the expression of the UPR marker BiP and showed a negative association with the number of hereditary MYDISEASETOKEN clinical manifestations.
28930842	2	11	ENSP00000261024	DOID:2352	The present study is the first report to identify a classical splicing mutation in the MYGENETOKEN gene in type 4B MYDISEASETOKEN, and provide further evidence of the prevalence of type 4 hereditary MYDISEASETOKEN in Asian countries.
11431687	1	1	ENSP00000261024	DOID:2352	A mutation in MYGENETOKEN is associated with autosomal dominant MYDISEASETOKEN.
16923517	1	1	ENSP00000223051	DOID:2352	Homozygous p.M172K mutation of the MYGENETOKEN gene in an Italian family with type 3 hereditary MYDISEASETOKEN and early onset iron overload.
24065958	2	2	ENSP00000250971	DOID:2352	Similar to humans with insulin resistance, managed bottlenose dolphins (Tursiops truncatus) diagnosed with MYDISEASETOKEN (iron overload) have higher levels of 2 h post-prandial plasma MYGENETOKEN than healthy controls.
8138245	1	1	ENSP00000366005	DOID:2352	Where does the gene for MYDISEASETOKEN lie in relation to MYGENETOKEN?
5485552	1	1	ENSP00000250971	DOID:2352	[Determination of plasma MYGENETOKEN in primary MYDISEASETOKEN].
17264300	1	1	ENSP00000337014	DOID:2352	Defective targeting of MYGENETOKEN to plasma membrane is a common pathogenetic mechanism in juvenile MYDISEASETOKEN.
15316097	2	10	ENSP00000255030	DOID:2352	Elevated serum ferritin levels could not be explained by an acute phase response as determined by MYGENETOKEN, or MYDISEASETOKEN (DNA analysis).
11551099	2	3	ENSP00000223051	DOID:2352	Recently, a mutation in the gene encoding MYGENETOKEN (exon 6, nucleotide 750 C --&gt; G; Y250X) was detected by a PCR-restriction fragment length polymorphism (RFLP) method in Sicilians with MYDISEASETOKEN.
7078263	1	1	ENSP00000348564	DOID:2352	Use of subcutaneous deferoxamine in a child with MYDISEASETOKEN associated with MYGENETOKEN.
16604073	2	5	ENSP00000337014	DOID:2352	Here, we report that MYGENETOKEN is a BMP coreceptor and that MYGENETOKEN mutants associated with MYDISEASETOKEN have impaired BMP signaling ability.
25666510	2	1	ENSP00000337014	DOID:2352	The gene encoding human MYGENETOKEN (MYGENETOKEN) is one of the genes that, when mutated, can cause juvenile MYDISEASETOKEN, an early-onset inherited disorder associated with iron overload.
17241880	2	2	ENSP00000223051	DOID:2352	Mutations of MYGENETOKEN in humans cause type 3 hereditary MYDISEASETOKEN.
15935710	2	4	ENSP00000261024	DOID:2352	Recently, MYGENETOKEN mutations leading to MYDISEASETOKEN (MYGENETOKEN) have been identified.
12606179	2	8	ENSP00000261024	DOID:2352	Hepatic MYGENETOKEN expression was greatly upregulated in patients with MYDISEASETOKEN (1.8-fold, 95% CI 1.5-2.2; p=0.002).
28930842	1	1	ENSP00000261024	DOID:2352	Type 4B hereditary MYDISEASETOKEN associated with a novel mutation in the MYGENETOKEN gene: A case report and a review of the literature.
16258219	2	5	ENSP00000261024	DOID:2352	These affected subjects were heterozygous for 1467A&gt;C (R489S) in MYGENETOKEN, and without other mutations of the MYDISEASETOKEN genes.
11351203	1	1	ENSP00000333994	DOID:2352	Transfusional MYDISEASETOKEN of the choroid plexus in MYGENETOKEN.
11551099	1	1	ENSP00000223051	DOID:2352	A rapid PCR-SSP assay for the MYDISEASETOKEN-associated Tyr250Stop mutation in the MYGENETOKEN gene.
17019598	1	1	ENSP00000250971	DOID:2352	Increased MYGENETOKEN secretory capacity but decreased insulin sensitivity after correction of iron overload by phlebotomy in hereditary MYDISEASETOKEN.
12091366	1	1	ENSP00000261024	DOID:2352	Novel mutation in MYGENETOKEN is associated with autosomal dominant MYDISEASETOKEN.
7874124	2	5	ENSP00000366005	DOID:2352	The MYDISEASETOKEN critical region extending from proximal of MYGENETOKEN to distal of D6S105 is therefore large.
9303489	1	1	ENSP00000221930	DOID:2352	Excess iron induces hepatic oxidative stress and MYGENETOKEN in genetic MYDISEASETOKEN.
15749661	1	1	ENSP00000223051	DOID:2352	Two novel mutations, L490R and V561X, of the MYGENETOKEN gene in Japanese patients with MYDISEASETOKEN.
16424663	1	1	ENSP00000337014	DOID:2352	A juvenile MYDISEASETOKEN patient homozygous for a novel deletion of cDNA nucleotide 81 of MYGENETOKEN.
26266058	2	2	ENSP00000333994	DOID:2352	MYGENETOKEN is one of the causes of secondary MYDISEASETOKEN due to regular transfusional treatment for maintaining adequate levels of hemoglobin.
20234129	1	1	ENSP00000337014	DOID:2352	MYDISEASETOKEN and MYGENETOKEN G320V homozygosity in a Hungarian woman.
16257244	1	1	ENSP00000261024	DOID:2352	Autosomal dominant hereditary MYDISEASETOKEN associated with two novel MYGENETOKEN mutations in Spain.
24584909	2	2	ENSP00000337014	DOID:2352	Here, we report a heterozygous genotype at two mutation sites in MYGENETOKEN (MYGENETOKEN) present in two brothers with middle-age-onset MYDISEASETOKEN in a Chinese family.
15703643	2	7	ENSP00000261024	DOID:2352	A mutation in MYGENETOKEN produced a form of MYDISEASETOKEN with excessive iron in hepatocytes and also in Kupffer cells and macrophages.
7918084	2	4	ENSP00000366005	DOID:2352	Allele 8 of the more telomeric locus D6S105 was also strongly associated with MYDISEASETOKEN (RR = 13.0; Chi2 = 21.1) but alleles at this locus were not in strong linkage disequilibrium with MYGENETOKEN alleles in the control subjects.
6167540	2	1	ENSP00000366005	DOID:2352	The purpose of this paper is to report a pedigree with hereditary MYDISEASETOKEN in which a recombination between the MYGENETOKEN and B loci occurred.
