23156704	2	1	ENSP00000250971	DOID:2352	MYDISEASETOKEN in bottlenose dolphins (Tursiops truncatus) is associated with high postprandial plasma MYGENETOKEN levels, suggestive of insulin resistance.
7942036	2	2	ENSP00000333994	DOID:2352	This article describes two patients with MYGENETOKEN and MYDISEASETOKEN complicated by Klebsiella pneumoniae liver abscess.
26385212	2	5	ENSP00000333994	DOID:2352	Overall, highest assay levels were observed for patients with untreated hereditary MYDISEASETOKEN and MYGENETOKEN, patients with transfusion-dependent myelodysplastic syndromes and patients with transfusion-dependent and chelated MYGENETOKEN.
23105707	2	3	ENSP00000447173	DOID:2352	Three genes related to lead metabolism, exhibiting polymorphism have already been demonstrated-DeltaALA-dehydratase, MYGENETOKEN gene and MYDISEASETOKEN gene.
19234060	2	2	ENSP00000337014	DOID:2352	Knockout (KO) mice lacking MYGENETOKEN (Hjv-/-) spontaneously load with dietary iron and, therefore, present a model for hereditary MYDISEASETOKEN (HH).
12134060	1	1	ENSP00000223051	DOID:2352	Targeted mutagenesis of the murine MYGENETOKEN gene produces MYDISEASETOKEN.
16054062	2	3	ENSP00000222304	DOID:2352	If ferroportin is the major cellular iron exporter, ineffective MYGENETOKEN function could explain manifestations of human MYDISEASETOKEN disorders.
10675018	2	2	ENSP00000308541	DOID:2352	The mutations causing MYDISEASETOKEN and thrombogenetic diseases (factor V Leiden mutation and MYGENETOKEN mutation) are well defined.
17557668	1	1	ENSP00000222304	DOID:2352	[Hereditary MYDISEASETOKEN: novel genes, novel diseases and MYGENETOKEN].
11431687	2	4	ENSP00000261024	DOID:2352	We report that a mutation in the gene encoding Solute Carrier family 11, member A3 (MYGENETOKEN), also known as ferroportin, is associated with autosomal dominant MYDISEASETOKEN.
16424658	2	1	ENSP00000223051	DOID:2352	We report three mutations of MYGENETOKEN (MYGENETOKEN)--R396X (exon 9; nt 1186C--&gt;T), R455Q (exon 10; nt 1364G--&gt;A) and G792R (exon 18; nt 2374G--&gt;A)--in a man of Scottish descent with MYDISEASETOKEN and severe iron overload.
18492090	2	8	ENSP00000337014	DOID:2352	We conclude that homozygosity for MYGENETOKEN R54X accounts for his severe, early age-of-onset MYDISEASETOKEN; his phenotype was probably modified by serial phlebotomy therapy.
23333676	2	3	ENSP00000223051	DOID:2352	To identify features that are common across different forms of MYDISEASETOKEN, we used microarray and real-time reverse transcription polymerase chain reaction (RT-PCR) to assess brain transcriptome profiles of MYGENETOKEN mutant mice (MYGENETOKEN(mut)), a model of a rare type of hereditary MYDISEASETOKEN, relative to wildtype control mice.
25635054	2	1	ENSP00000223051	DOID:2352	Mutations in MYGENETOKEN (MYGENETOKEN) cause a rare form of the hereditary MYDISEASETOKEN, resulting in iron overload predominantly in the liver.
1349563	2	4	ENSP00000366005	DOID:2352	Only one marker presents an unequivocal association with the MYDISEASETOKEN gene and is 100 kb centromeric to MYGENETOKEN.
24003015	2	3	ENSP00000366525	DOID:2352	We report a patient with HHCS who was misdiagnosed and treated as having MYDISEASETOKEN, in whom a heterozygous c.-160A&gt;G mutation was identified in the iron responsive element (IRE) of MYGENETOKEN, causing ferritin synthesis in the absence of iron overload.
26238956	2	5	ENSP00000337014	DOID:2352	This chromosome region contained MYGENETOKEN, a critical gene involved in hereditary MYDISEASETOKEN.
13767975	1	1	ENSP00000369351	DOID:2352	Cardiac complications of chronic, severe, MYGENETOKEN with MYDISEASETOKEN.
15194541	1	1	ENSP00000337014	DOID:2352	Prevalence of the G320V mutation of the MYGENETOKEN gene, associated with juvenile MYDISEASETOKEN, in Greece.
10681454	1	1	ENSP00000223051	DOID:2352	MYGENETOKEN: continued expression in mouse liver in the face of iron overload and in hereditary MYDISEASETOKEN.
18590684	2	1	ENSP00000222304	DOID:2352	MYGENETOKEN, the systemic regulator of iron homeostasis is activated by proteins responsible for hereditary MYDISEASETOKEN, bone morphogenetic proteins (BMPs), and inflammatory cytokines.
18105260	1	1	ENSP00000369351	DOID:2352	MYDISEASETOKEN with aplastic or MYGENETOKEN.
22383097	1	1	ENSP00000223051	DOID:2352	Disruption of MYDISEASETOKEN protein and MYGENETOKEN causes iron-induced liver injury in mice.
16424658	1	1	ENSP00000223051	DOID:2352	MYDISEASETOKEN and severe iron overload associated with compound heterozygosity for MYGENETOKEN R455Q and two novel mutations MYGENETOKEN R396X and G792R.
17019598	2	1	ENSP00000250971	DOID:2352	We recently demonstrated that humans with hereditary MYDISEASETOKEN have decreased MYGENETOKEN secretory capacity with a compensatory increase in insulin sensitivity.
19622835	2	1	ENSP00000222304	DOID:2352	Impaired regulation of MYGENETOKEN expression in response to iron loading appears to be the pathogenic mechanism for hereditary MYDISEASETOKEN.
15998830	2	1	ENSP00000337014	DOID:2352	Mutations in a recently identified gene MYGENETOKEN (also called MYGENETOKEN, or repulsive guidance molecule C, MYGENETOKEN) are the major cause of juvenile MYDISEASETOKEN (JH).
16364680	2	6	ENSP00000263735	DOID:2352	For DNs and hereditary MYDISEASETOKEN, MYGENETOKEN expression was found in 10 and 50% (3/30 and 2/4), respectively.
7649553	2	1	ENSP00000366005	DOID:2352	The gene responsible for hereditary MYDISEASETOKEN has been shown to be closely linked to the MYGENETOKEN and D6S105 loci on the short arm of chromosome 6.
12469120	1	1	ENSP00000222304	DOID:2352	Mutant antimicrobial peptide MYGENETOKEN is associated with severe juvenile MYDISEASETOKEN.
15610558	2	1	ENSP00000337014	DOID:2352	Homozygosity or compound heterozygosity for coding region mutations of the MYGENETOKEN gene (MYGENETOKEN) in whites is a cause of early age-of-onset iron overload (juvenile MYDISEASETOKEN), and of MYDISEASETOKEN phenotypes in some young or middle-aged adults.
15760675	2	3	ENSP00000398698	DOID:2352	We performed a review of published studies linking IHD with gene polymorphisms of the MHC molecules tumor necrosis factor (MYGENETOKEN)-alpha and -beta, the class II DR human leukocyte antigens, heat shock protein 70-1, MYDISEASETOKEN related gene, and complement C4.
23464809	2	2	ENSP00000337014	DOID:2352	Mutations in MYGENETOKEN cause juvenile MYDISEASETOKEN, a rapidly progressing iron overload disorder in humans.
8328453	2	1	ENSP00000366005	DOID:2352	The MYDISEASETOKEN (HC) gene is known to be linked to MYGENETOKEN (6p21.3); however, its precise location has been difficult to determine because of a lack of additional highly polymorphic markers for this region.
17557668	2	5	ENSP00000222304	DOID:2352	Plasma MYGENETOKEN concentration is elevated in body iron excess and by inflammatory stimuli, and is lowered in erythroid iron demand, hypoxia and most types of hereditary MYDISEASETOKEN.
15198949	1	1	ENSP00000222304	DOID:2352	Severe MYDISEASETOKEN in a Portuguese family associated with a new mutation in the 5'-UTR of the MYGENETOKEN gene.
19399775	2	9	ENSP00000222304	DOID:2352	Urine MYGENETOKEN levels were 10 nmol/mmol creatinine in healthy controls, with reduced levels in hereditary MYDISEASETOKEN (P &lt; 0.000005) and elevated levels in inflammation (P &lt; 0.0007).
15737887	2	4	ENSP00000222304	DOID:2352	A milestone was the discovery that MYGENETOKEN, the key iron regulator in mice, is the gene mutated in the most severe, juvenile form of MYDISEASETOKEN.
24847265	2	5	ENSP00000223051	DOID:2352	However, MYGENETOKEN null mice as well as MYGENETOKEN MYDISEASETOKEN patients do not show defective erythropoiesis and tolerate repeated phlebotomy.
12940442	2	4	ENSP00000398698	DOID:2352	Our aim was to study the role of MYGENETOKEN and its promoter polymorphisms in the phenotypic expression of MYDISEASETOKEN in individuals with and without the C282Y mutation.
13302168	1	2	ENSP00000369351	DOID:2352	I.  MYDISEASETOKEN and MYGENETOKEN.
10802645	1	1	ENSP00000223051	DOID:2352	The gene MYGENETOKEN is mutated in a new type of MYDISEASETOKEN mapping to 7q22.
23169885	2	13	ENSP00000337014	DOID:2352	Similarly, RPE cells from MYGENETOKEN (MYGENETOKEN)-knockout mice, another model of MYDISEASETOKEN, also had increased expression of GLUTs, HDACs, and DNMTs.
19625109	2	1	ENSP00000222304	DOID:2352	In the last few years, biochemical and molecular study of the various types of MYDISEASETOKEN have established that the MYGENETOKEN peptide is the central regulator of iron absorption.
18584923	2	7	ENSP00000223051	DOID:2352	Juvenile MYDISEASETOKEN (type 2) and type 3 MYDISEASETOKEN (mutation of the MYGENETOKEN) are very uncommon.
15486069	2	2	ENSP00000222304	DOID:2352	Recent evidence indicates that certain forms of hereditary MYDISEASETOKEN are caused by MYGENETOKEN deficiency.
9306096	2	1	ENSP00000366005	DOID:2352	Genes that predispose to MYDISEASETOKEN are though to be located within the several megabases telomeric of MYGENETOKEN.
11472372	2	1	ENSP00000264613	DOID:2352	As MYGENETOKEN (Cp) seems to be involved in iron mobilization, serum Cp levels were measured in 35 patients with hereditary MYDISEASETOKEN (HH), 12 with acquired iron overload (AIO) and 36 healthy subjects.
14982867	1	1	ENSP00000337014	DOID:2352	Genetic abnormalities and juvenile MYDISEASETOKEN: mutations of the MYGENETOKEN gene encoding MYGENETOKEN.
3475981	1	1	ENSP00000366005	DOID:2352	A study of 609 HLA haplotypes marking for the MYDISEASETOKEN gene: (1) mapping of the gene near the MYGENETOKEN locus and characters required to define a heterozygous population and (2) hypothesis concerning the underlying cause of MYDISEASETOKEN-HLA association.
21675259	2	4	ENSP00000308541	DOID:2352	Eleven polymorphisms in 7 genes coding hemostasis protein synthesis were investigated: V Leiden G1691A factor, G20210A MYGENETOKEN, C677T methylentetrahydrofolatreductase, A1298C methylentetrahydrofolatreductase, type 1 plasminogen activator inhibitor, 4G/5G promoter region, XIII V34L coagulation factor, IIIa L33P thrombocytic glycoprotein, C282Y MYDISEASETOKEN, G854A beta-fibrinogen, G455A beta-fibrinogen, C249T beta-fibrinogen.
21136275	2	2	ENSP00000222304	DOID:2352	Changes in the expression of MYGENETOKEN are known to be the key pathogenic factors in hereditary MYDISEASETOKEN and are associated with infection and inflammation.
24393578	2	4	ENSP00000222304	DOID:2352	However, the emerging details of the physiology of MYGENETOKEN, the key hormone in iron recycling, suggest a resolution of the apparent paradox of an important role for iron in atherogenesis in the possible absence of increased plaque burden in most types of hereditary MYDISEASETOKEN.
11358390	2	18	ENSP00000223051	DOID:2352	Thus, MYGENETOKEN mutations are not responsible for MYDISEASETOKEN in non-C282Y homozygous patients of our area.
17188970	1	1	ENSP00000222304	DOID:2352	Increased expression of MYGENETOKEN in obese patients: impact on phenotypic expression of MYDISEASETOKEN and pathophysiology of dysmetabolic iron overload syndrome.
20039160	2	9	ENSP00000261024	DOID:2352	Type 4 MYDISEASETOKEN follows an autosomal dominant trait; the corresponding mutation affects the basolateral iron carrier MYGENETOKEN.
15818147	2	3	ENSP00000222304	DOID:2352	For example, the role of MYGENETOKEN dysregulation in MYDISEASETOKEN has been a surprising discovery that provides some mechanistic understanding for the increased iron absorption that is present in this disorder.
11358391	1	1	ENSP00000223051	DOID:2352	Commentary: mutations of MYGENETOKEN (Trf-2) and MYDISEASETOKEN.
16537241	1	1	ENSP00000222304	DOID:2352	MYDISEASETOKEN, MYGENETOKEN and disorders of iron metabolism: fields of substantial clinical relevance and current advances.
15099344	1	1	ENSP00000222304	DOID:2352	A homozygous MYGENETOKEN mutation in a multiply consanguineous family with pseudo-dominant juvenile MYDISEASETOKEN.
15685557	2	11	ENSP00000223051	DOID:2352	A 21-year-old brother with a milder phenotype resembling classic adult-onset hereditary MYDISEASETOKEN carried only the Q317X serum MYGENETOKEN homozygote mutation.
1558977	2	7	ENSP00000398698	DOID:2352	We conclude that release of MYGENETOKEN by monocytes may be selectively impaired in hereditary MYDISEASETOKEN.
6167540	2	5	ENSP00000366005	DOID:2352	Thus, the MYDISEASETOKEN locus maps in close proximity to the MYGENETOKEN locus.
12150153	1	1	ENSP00000223051	DOID:2352	Mutation analysis of MYGENETOKEN in patients with atypical MYDISEASETOKEN.
15703644	2	6	ENSP00000222304	DOID:2352	Other data suggests that the altered regulation of the peptide MYGENETOKEN may play a pivotal role in the development of the iron overload phenotype in patients with MYDISEASETOKEN.
15124225	2	5	ENSP00000223051	DOID:2352	The development of these mice will provide new models for type 3 MYDISEASETOKEN and assist in determining the role of MYGENETOKEN in iron metabolism.
14656876	1	1	ENSP00000222304	DOID:2352	MYGENETOKEN, a candidate modifier of the MYDISEASETOKEN phenotype in mice.
12091366	2	6	ENSP00000261024	DOID:2352	We report the finding of a novel mutation (V162del) in MYGENETOKEN in an Australian family with autosomal dominant MYDISEASETOKEN.
24714983	2	2	ENSP00000261024	DOID:2352	MYGENETOKEN mutations fall into two functional categories (loss- versus gain-of-function) underlying two distinct clinical entities (MYDISEASETOKEN type 4A versus type 4B).
28425416	1	1	ENSP00000355607	DOID:2352	MYGENETOKEN rs11558492 is not a Major Modifier of Iron Status: Study of Italian MYDISEASETOKEN Patients and Blood Donors.
15147384	1	1	ENSP00000223051	DOID:2352	Early onset hereditary MYDISEASETOKEN resulting from a novel MYGENETOKEN gene nonsense mutation (R105X) in two siblings of north French descent.
3504294	1	1	ENSP00000250971	DOID:2352	[Evaluation of the endocrine function and study of the anti-MYGENETOKEN antibodies in MYDISEASETOKEN].
12091366	2	5	ENSP00000261024	DOID:2352	Recently, 2 mutations in the MYGENETOKEN gene, which encodes the iron transport protein MYGENETOKEN, have been implicated in families with autosomal dominant MYDISEASETOKEN from the Netherlands and Italy.
2219895	2	2	ENSP00000366005	DOID:2352	The gene that is abnormal in MYDISEASETOKEN is found on the short arm of chromosome 6 in close proximity (approximately 1 centimorgan) to MYGENETOKEN, but the product coded for by that gene is unknown.
19393287	2	2	ENSP00000222304	DOID:2352	Inappropriately low MYGENETOKEN expression is implicated in the pathogenesis of hereditary MYDISEASETOKEN and iron-loading anemias, like the thalassemias.
12809944	1	1	ENSP00000223051	DOID:2352	AVAQ 594-597 deletion of the MYGENETOKEN gene in a Japanese family with MYDISEASETOKEN.
12618377	2	9	ENSP00000364731	DOID:2352	Unambiguous typing was achieved for clinically relevant loci within the MYGENETOKEN and MYDISEASETOKEN genes.
22392951	2	6	RMRP	DOID:2352	Before diagnosing MYGENETOKEN, however, it is necessary to rule out a pituitary tumor or pituitary infiltration by imaging studies, juvenile MYDISEASETOKEN, and a systemic disorder that, by undermining nutritional status, could affect gonadotropin secretion and pubertal development.
2741950	2	5	ENSP00000366005	DOID:2352	In addition, HLA-A2 and -B12 were in significant linkage disequilibrium in patients but not in controls, which may indicate a new mutation or recent recombination between MYGENETOKEN and MYDISEASETOKEN either in our patient group or in the founding population.
19625109	1	1	ENSP00000222304	DOID:2352	[Role of MYGENETOKEN in the pathogenesis of MYDISEASETOKEN].
18293685	2	5	ENSP00000337014	DOID:2352	The Online Mendelian Inheritance in Man database has lists four types of hereditary MYDISEASETOKEN, each of them caused by a different gene mutation (hepcidine, MYGENETOKEN, transferring receptor 2, ferroportin).
10802645	2	4	ENSP00000223051	DOID:2352	7). Here we report a new locus (MYGENETOKEN) on 7q22 and show that a homozygous nonsense mutation in the gene encoding MYGENETOKEN (MYGENETOKEN) is found in people with MYDISEASETOKEN that maps to MYGENETOKEN.
23160508	2	3	ENSP00000369351	DOID:2352	We report a case of a 78- year-old man with MYDISEASETOKEN who developed MYGENETOKEN with excess of blasts.
22896664	2	3	ENSP00000337014	DOID:2352	We used MYGENETOKEN-knockout (MYGENETOKEN(-/-)) mice to examine whether MYDISEASETOKEN restores the virulence defects of nonpigmented Y. pestis.
23996780	1	1	ENSP00000222304	DOID:2352	MYGENETOKEN in MYDISEASETOKEN: the message or the messenger?
3359685	2	1	ENSP00000366005	DOID:2352	MYGENETOKEN, -B, -C and -DR antigens were determined in 70 unrelated Danish patients with idiopathic MYDISEASETOKEN.
6381191	2	8	ENSP00000250971	DOID:2352	Since pancreatic insulin secretion (C-peptide), glucagon secretion, and the entero-insulinar axis (GIP) are not impaired in these non-cirrhotic patients with idiopathic MYDISEASETOKEN, iron accumulation in the hepatocytes may be responsible for the impaired MYGENETOKEN effect and may cause impaired hepatic MYGENETOKEN extraction.
17339196	2	2	ENSP00000337014	DOID:2352	The child was found to have a combination of a novel R176C mutation together with the G320V mutation in the juvenile MYDISEASETOKEN gene (MYGENETOKEN).
16409153	2	3	ENSP00000222304	DOID:2352	MYGENETOKEN, with its cognate receptor, ferroportin, has emerged as a central regulator of iron homeostasis; all of the known causes of MYDISEASETOKEN appear to prevent this system from functioning normally.
16446107	2	12	ENSP00000332369	DOID:2352	Thus, MYGENETOKEN mutations might contribute to more severe iron loading in persons with primary MYDISEASETOKEN.
11358390	1	1	ENSP00000223051	DOID:2352	MYGENETOKEN gene and non-C282Y homozygous patients with MYDISEASETOKEN.
23600741	1	1	ENSP00000223051	DOID:2352	Variable age of onset and clinical severity in MYGENETOKEN related MYDISEASETOKEN: novel observations.
16868025	2	9	ENSP00000337014	DOID:2352	Our results define a series of biosynthetic steps leading to the normal production of different MYGENETOKEN isoforms in cells, and provide a framework for understanding the biochemical basis of defects in the maturation of MYGENETOKEN in juvenile MYDISEASETOKEN.
15713792	2	2	ENSP00000222304	DOID:2352	To understand the mechanisms whereby MYGENETOKEN controls iron homeostasis in vivo, we have analyzed the level of iron-related proteins by Western blot and immunohistochemistry in MYGENETOKEN-deficient mice, a mouse model of severe MYDISEASETOKEN.
22990014	2	1	ENSP00000222304	DOID:2352	The deficiency of MYGENETOKEN, the hormone that controls iron absorption and its tissue distribution, is the cause of iron overload in nearly all forms of hereditary MYDISEASETOKEN and in untransfused iron-loading anemias.
17229647	1	1	ENSP00000222304	DOID:2352	Molecular mechanism of MYGENETOKEN deficiency in a patient with juvenile MYDISEASETOKEN.
23985001	2	1	ENSP00000222304	DOID:2352	Hereditary MYDISEASETOKEN is an inherited iron overload disorder caused by inappropriately low MYGENETOKEN secretion leading to increased duodenal absorption of dietary iron, most commonly in C282Y homozygous individuals.
27667164	2	8	ENSP00000222304	DOID:2352	In conclusion, increased intracellular iron content in recombinant cells did not increase MYGENETOKEN responses compared to wild-type cells, resembling MYDISEASETOKEN.
27445333	1	1	ENSP00000261024	DOID:2352	Non-mutagenic Suppression of Enterocyte MYGENETOKEN by Chemical Ribosomal Inactivation via p38 Mitogen-activated Protein Kinase (MAPK)-mediated Regulation: EVIDENCE FOR ENVIRONMENTAL MYDISEASETOKEN.
22924847	2	6	ENSP00000337014	DOID:2352	Two of the three patients with the MYGENETOKEN genotype displayed classic MYDISEASETOKEN instead of the juvenile type.
2741950	2	1	ENSP00000366005	DOID:2352	The frequencies of different MYGENETOKEN and -B alleles in 77 Australian patients with MYDISEASETOKEN have been compared with frequencies of HLA alleles not associated with MYDISEASETOKEN in 63 of their heterozygous relatives and with published population frequencies.
15749661	2	3	ENSP00000223051	DOID:2352	This suggests that the MYGENETOKEN gene is involved in MYDISEASETOKEN in Japanese patients.
25152992	1	1	ENSP00000337014	DOID:2352	Juvenile MYDISEASETOKEN associated with heterozygosity for novel MYGENETOKEN mutations and with unknown cofactors.
25441019	1	1	ENSP00000261024	DOID:2352	[Usefulness of a diagnostic algorithm hyperferritinemia: A case report of a Spanish family with hereditary MYDISEASETOKEN and mutation in MYGENETOKEN gene].
19415085	2	9	ENSP00000222304	DOID:2352	The pathogenesis is not fully elucidated but recent reports indicate that the protein MYGENETOKEN (produced in the liver) plays a key role in the development of MYDISEASETOKEN.
21161013	2	7	ENSP00000222304	DOID:2352	MYGENETOKEN has been suggested to act as a modifier gene in genetic MYDISEASETOKEN.
9784832	2	2	ENSP00000366005	DOID:2352	The MYDISEASETOKEN gene is probably located close to the MYGENETOKEN locus on the short arm of chromosome 6.
20887198	2	3	ENSP00000222304	DOID:2352	MYGENETOKEN deficiency results in iron overload in hereditary MYDISEASETOKEN and ineffective erythropoiesis.
10802645	2	3	ENSP00000337014	DOID:2352	A locus for juvenile MYDISEASETOKEN (MYGENETOKEN) maps to 1q (ref.
16407589	2	5	ENSP00000222304	DOID:2352	MYGENETOKEN deficiency due to the dysregulation of its synthesis causes most known forms of MYDISEASETOKEN.
2799116	2	24	ENSP00000369351	DOID:2352	Transfusion MYDISEASETOKEN is the principal risk in MYGENETOKEN: this risk can be prevented by iron chelating agents in patients with frequent blood perfusions.
18450729	1	1	ENSP00000223051	DOID:2352	Early-onset MYDISEASETOKEN caused by a novel combination of MYGENETOKEN mutations(p.R396X/c.1538-2 A&gt;G) in a woman of Italian descent.
9874546	2	1	ENSP00000333994	DOID:2352	To identify the optimal MR imaging technique for diagnosing pituitary iron overload, we compared spin-echo and gradient-echo MR imaging with measurements of pituitary T2 relaxation times in 30 patients with secondary MYDISEASETOKEN due to transfusion-dependent MYGENETOKEN and in 10 healthy volunteers.
3938164	1	1	ENSP00000262544	DOID:2352	Severe MYDISEASETOKEN: the predominant clinical manifestation of MYGENETOKEN.
18287331	2	1	ENSP00000337014	DOID:2352	Juvenile MYDISEASETOKEN is a severe and rapidly progressing hereditary disorder of iron overload, and it is caused primarily by defects in the gene encoding repulsive guidance molecule c/MYGENETOKEN (MYGENETOKEN/MYGENETOKEN), a recently identified protein that undergoes a complicated biosynthetic pathway in muscle and liver, leading to cell membrane-linked single-chain and heterodimeric species, and two secreted single-chain isoforms.
12865285	2	3	ENSP00000261024	DOID:2352	The disorder has similarities to type 4 MYDISEASETOKEN, which is caused by mutations in MYGENETOKEN.
23686013	2	6	ENSP00000222304	DOID:2352	Questions arise from the lack of conservation in Drosophila for key mammalian players, such as ferroportin, MYGENETOKEN and all the components of the MYDISEASETOKEN-related pathway.
16424658	2	4	ENSP00000223051	DOID:2352	We conclude that this patient represents another example of MYDISEASETOKEN due to mutations of the gene encoding MYGENETOKEN.
15897636	1	1	ENSP00000261024	DOID:2352	MYDISEASETOKEN with mutation of the MYGENETOKEN (MYGENETOKEN) gene.
15967692	2	1	ENSP00000337014	DOID:2352	MYGENETOKEN (MYGENETOKEN) is a recently discovered gene responsible for 1q-linked juvenile MYDISEASETOKEN.
21654321	2	3	ENSP00000222304	DOID:2352	Recent studies suggest that iron accumulation in most types of MYDISEASETOKEN is due to deficiency of MYGENETOKEN, a central iron regulator.
2338199	2	9	ENSP00000366005	DOID:2352	The present findings favor a location of the MYDISEASETOKEN locus telomeric to MYGENETOKEN.
7874124	2	1	ENSP00000366005	DOID:2352	The gene for hereditary MYDISEASETOKEN (HC) is linked to MYGENETOKEN and D6S105 on chromosome 6p.
15831700	1	1	ENSP00000222304	DOID:2352	Resistance to MYGENETOKEN is conferred by MYDISEASETOKEN-associated mutations of ferroportin.
18164971	2	1	ENSP00000348068	DOID:2352	Hereditary MYDISEASETOKEN and MYGENETOKEN mutation were reported to affect liver functions.
18445598	2	1	ENSP00000337014	DOID:2352	MYGENETOKEN (MYDISEASETOKEN type 2 gene) is highly expressed in skeletal muscle and liver hepatocytes.
24860505	2	1	ENSP00000337014	DOID:2352	Mutations in MYGENETOKEN (MYGENETOKEN) are the most common cause of the juvenile-onset form of the iron overload disorder hereditary MYDISEASETOKEN.
10950940	2	1	ENSP00000337014	DOID:2352	MYDISEASETOKEN type 2 (MYGENETOKEN) or juvenile MYDISEASETOKEN (JH) is a rare recessive disorder that causes iron overload, characterized by early onset and severe clinical course.
12192634	1	1	ENSP00000369351	DOID:2352	[An older female patient with MYGENETOKEN and MYDISEASETOKEN].
15124225	2	2	ENSP00000223051	DOID:2352	Mutations in MYGENETOKEN lead to type 3 MYDISEASETOKEN in humans.
18094142	1	1	ENSP00000223051	DOID:2352	Defective trafficking and localization of mutated MYGENETOKEN: implications for type 3 hereditary MYDISEASETOKEN.
15935710	2	5	ENSP00000261024	DOID:2352	MYGENETOKEN differs from classical MYDISEASETOKEN in that there is a greater amount of macrophage iron sequestration.
21548776	2	5	ENSP00000222304	DOID:2352	Findings in murine models support the concept that the pathogenesis of nearly all forms of hereditary MYDISEASETOKEN involves inappropriately low expression of MYGENETOKEN.
16111902	2	1	ENSP00000261024	DOID:2352	We report a new mutation, Asn185Asp, in exon 6 of the ferroportin gene (MYGENETOKEN) in 15 members of three successive generations of a Canadian family of Scandinavian origin with autosomal dominant MYDISEASETOKEN.
909547	2	6	ENSP00000366005	DOID:2352	The lod-score value (2.239 for theta = 0.005) in six families available for study further supports the conclusion that a MYDISEASETOKEN gene is closely linked to the MYGENETOKEN locus.
24635876	1	1	ENSP00000337014	DOID:2352	Hereditary MYDISEASETOKEN caused by homozygous MYGENETOKEN mutation evolved through paternal disomy.
